Is there Marketplace in Birmingham	query ( area ( keyval ( 'name' , 'Birmingham' ) ) , nwr ( keyval ( 'amenity' , 'marketplace' ) ) , qtype ( least ( topx ( 1 ) ) ) )
How many Bay in Birmingham	query ( area ( keyval ( 'name' , 'Birmingham' ) ) , nwr ( keyval ( 'natural' , 'bay' ) ) , qtype ( count ) )
Is there Raceways near Frampton Close in Birmingham in walking distance	query ( around ( center ( area ( keyval ( 'name' , 'Birmingham' ) ) , nwr ( keyval ( 'name' , 'Frampton_Close' ) ) ) , search ( nwr ( keyval ( 'highway' , 'raceway' ) ) ) , maxdist ( WALKING_DIST ) ) , qtype ( least ( topx ( 1 ) ) ) )
place Farms in Birmingham	query ( area ( keyval ( 'name' , 'Birmingham' ) ) , nwr ( keyval ( 'place' , 'farm' ) ) , qtype ( findkey ( 'place' ) ) )
indoor Stationery Shop in Birmingham	query ( area ( keyval ( 'name' , 'Birmingham' ) ) , nwr ( keyval ( 'shop' , 'stationery' ) ) , qtype ( findkey ( 'indoor' ) ) )
Is there Newsagents near Marsh Hill in Birmingham	query ( around ( center ( area ( keyval ( 'name' , 'Birmingham' ) ) , nwr ( keyval ( 'name' , 'Marsh_Hill' ) ) ) , search ( nwr ( keyval ( 'shop' , 'newsagent' ) ) ) , maxdist ( DIST_INTOWN ) ) , qtype ( least ( topx ( 1 ) ) ) )
How many closest Youth Center from Dalman & Narborough Ltd in Birmingham	query ( around ( center ( area ( keyval ( 'name' , 'Birmingham' ) ) , nwr ( keyval ( 'name' , 'Dalman_&_Narborough_Ltd' ) ) ) , search ( nwr ( keyval ( 'amenity' , 'youth_centre' ) ) ) , maxdist ( DIST_INTOWN ) , topx ( 1 ) ) , qtype ( count ) )
Is there close by Night Club from Pritchatts Road in Birmingham	query ( around ( center ( area ( keyval ( 'name' , 'Birmingham' ) ) , nwr ( keyval ( 'name' , 'Pritchatts_Road' ) ) ) , search ( nwr ( keyval ( 'amenity' , 'nightclub' ) ) ) , maxdist ( DIST_INTOWN ) , topx ( 1 ) ) , qtype ( least ( topx ( 1 ) ) ) )
Is there Mooring in Birmingham	query ( area ( keyval ( 'name' , 'Birmingham' ) ) , nwr ( keyval ( 'waterway' , 'mooring' ) ) , qtype ( least ( topx ( 1 ) ) ) )
closest Tram Stop from E . F Edwards Funeral Directors in Birmingham	query ( around ( center ( area ( keyval ( 'name' , 'Birmingham' ) ) , nwr ( keyval ( 'name' , 'E.F_Edwards_Funeral_Directors' ) ) ) , search ( nwr ( keyval ( 'railway' , 'tram_stop' ) ) ) , maxdist ( DIST_INTOWN ) , topx ( 1 ) ) , qtype ( latlong ) )
name Living Streets near Alla-Aamin Mini Market in Birmingham	query ( around ( center ( area ( keyval ( 'name' , 'Birmingham' ) ) , nwr ( keyval ( 'name' , 'Alla-Aamin_Mini_Market' ) ) ) , search ( nwr ( keyval ( 'highway' , 'living_street' ) ) ) , maxdist ( DIST_INTOWN ) ) , qtype ( findkey ( 'name' ) ) )
listed status Waters in Birmingham	query ( area ( keyval ( 'name' , 'Birmingham' ) ) , nwr ( keyval ( 'natural' , 'water' ) ) , qtype ( findkey ( 'listed_status' ) ) )
Is there Bar in Birmingham	query ( area ( keyval ( 'name' , 'Birmingham' ) ) , nwr ( keyval ( 'amenity' , 'pub' ) ) , qtype ( least ( topx ( 1 ) ) ) )
How many closest Bed and Breakfast from Sea Garden Chinese and Cantonese Cuisine in Birmingham	query ( around ( center ( area ( keyval ( 'name' , 'Birmingham' ) ) , nwr ( keyval ( 'name' , 'Sea_Garden_Chinese_and_Cantonese_Cuisine' ) ) ) , search ( nwr ( keyval ( 'tourism' , 'bed_and_breakfast' ) ) ) , maxdist ( DIST_INTOWN ) , topx ( 1 ) ) , qtype ( count ) )
Is there Travel Agencys near Oxley Grove in Birmingham in walking distance	query ( around ( center ( area ( keyval ( 'name' , 'Birmingham' ) ) , nwr ( keyval ( 'name' , 'Oxley_Grove' ) ) ) , search ( nwr ( keyval ( 'shop' , 'travel_agency' ) ) ) , maxdist ( WALKING_DIST ) ) , qtype ( least ( topx ( 1 ) ) ) )
Where Furnitures near Artful Expression in Birmingham	query ( around ( center ( area ( keyval ( 'name' , 'Birmingham' ) ) , nwr ( keyval ( 'name' , 'Artful_Expression' ) ) ) , search ( nwr ( keyval ( 'shop' , 'furniture' ) ) ) , maxdist ( DIST_INTOWN ) ) , qtype ( latlong ) )
Water in Birmingham	query ( area ( keyval ( 'name' , 'Birmingham' ) ) , nwr ( keyval ( 'amenity' , 'drinking_water' ) ) , qtype ( latlong ) )
How many closest Peak from Birches Green Junior & Infant Schools in Birmingham	query ( around ( center ( area ( keyval ( 'name' , 'Birmingham' ) ) , nwr ( keyval ( 'name' , 'Birches_Green_Junior_&_Infant_Schools' ) ) ) , search ( nwr ( keyval ( 'natural' , 'peak' ) ) ) , maxdist ( DIST_INTOWN ) , topx ( 1 ) ) , qtype ( count ) )
Is there close by Prison from The Ridgeway in Birmingham	query ( around ( center ( area ( keyval ( 'name' , 'Birmingham' ) ) , nwr ( keyval ( 'name' , 'The_Ridgeway' ) ) ) , search ( nwr ( keyval ( 'amenity' , 'prison' ) ) ) , maxdist ( DIST_INTOWN ) , topx ( 1 ) ) , qtype ( least ( topx ( 1 ) ) ) )
waterway Riverbanks in Birmingham	query ( area ( keyval ( 'name' , 'Birmingham' ) ) , nwr ( keyval ( 'waterway' , 'riverbank' ) ) , qtype ( findkey ( 'waterway' ) ) )
addr street Flats in Birmingham	query ( area ( keyval ( 'name' , 'Birmingham' ) ) , nwr ( keyval ( 'building' , 'flats' ) ) , qtype ( findkey ( 'addr:street' ) ) )
Is there Galleries in Birmingham	query ( area ( keyval ( 'name' , 'Birmingham' ) ) , nwr ( keyval ( 'shop' , 'gallery' ) ) , qtype ( least ( topx ( 1 ) ) ) )
Garage in Birmingham	query ( area ( keyval ( 'name' , 'Birmingham' ) ) , nwr ( keyval ( 'building' , 'garage' ) ) , qtype ( latlong ) )
Is there close by Fire Hydrant from Selcombe Way in Birmingham	query ( around ( center ( area ( keyval ( 'name' , 'Birmingham' ) ) , nwr ( keyval ( 'name' , 'Selcombe_Way' ) ) ) , search ( nwr ( keyval ( 'amenity' , 'fire_hydrant' ) ) ) , maxdist ( DIST_INTOWN ) , topx ( 1 ) ) , qtype ( least ( topx ( 1 ) ) ) )
closest Parking from Merritts Brook in Birmingham in walking distance	query ( around ( center ( area ( keyval ( 'name' , 'Birmingham' ) ) , nwr ( keyval ( 'name' , 'Merritts_Brook' ) ) ) , search ( nwr ( keyval ( 'amenity' , 'parking' ) ) ) , maxdist ( WALKING_DIST ) , topx ( 1 ) ) , qtype ( latlong ) )
Is there Rubbish Bins near Aston Villa in Birmingham	query ( around ( center ( area ( keyval ( 'name' , 'Birmingham' ) ) , nwr ( keyval ( 'name' , 'Aston_Villa' ) ) ) , search ( nwr ( keyval ( 'amenity' , 'waste_basket' ) ) ) , maxdist ( DIST_INTOWN ) ) , qtype ( least ( topx ( 1 ) ) ) )
former name Restaurant in Birmingham	query ( area ( keyval ( 'name' , 'Birmingham' ) ) , nwr ( keyval ( 'amenity' , 'restaurant' ) ) , qtype ( findkey ( 'former_name' ) ) )
How many Colleges near Tay Road in Birmingham in walking distance	query ( around ( center ( area ( keyval ( 'name' , 'Birmingham' ) ) , nwr ( keyval ( 'name' , 'Tay_Road' ) ) ) , search ( nwr ( keyval ( 'amenity' , 'college' ) ) ) , maxdist ( WALKING_DIST ) ) , qtype ( count ) )
Where Night Club in Birmingham	query ( area ( keyval ( 'name' , 'Birmingham' ) ) , nwr ( keyval ( 'amenity' , 'nightclub' ) ) , qtype ( latlong ) )
How many Stations in Birmingham	query ( area ( keyval ( 'name' , 'Birmingham' ) ) , nwr ( keyval ( 'building' , 'train_station' ) ) , qtype ( count ) )
Is there close by Gift Shop from Chester Road in Birmingham in walking distance	query ( around ( center ( area ( keyval ( 'name' , 'Birmingham' ) ) , nwr ( keyval ( 'name' , 'Chester_Road' ) ) ) , search ( nwr ( keyval ( 'shop' , 'gift' ) ) ) , maxdist ( WALKING_DIST ) , topx ( 1 ) ) , qtype ( least ( topx ( 1 ) ) ) )
Is there Gas Stations near Hunton Hill in Birmingham	query ( around ( center ( area ( keyval ( 'name' , 'Birmingham' ) ) , nwr ( keyval ( 'name' , 'Hunton_Hill' ) ) ) , search ( nwr ( keyval ( 'amenity' , 'fuel' ) ) ) , maxdist ( DIST_INTOWN ) ) , qtype ( least ( topx ( 1 ) ) ) )
Where closest Retail Building from Stratford Street North in Birmingham	query ( around ( center ( area ( keyval ( 'name' , 'Birmingham' ) ) , nwr ( keyval ( 'name' , 'Stratford_Street_North' ) ) ) , search ( nwr ( keyval ( 'building' , 'retail' ) ) ) , maxdist ( DIST_INTOWN ) , topx ( 1 ) ) , qtype ( latlong ) )
closest Furniture from Chris's Café in Birmingham in walking distance	query ( around ( center ( area ( keyval ( 'name' , 'Birmingham' ) ) , nwr ( keyval ( 'name' , 'Chris's_Café' ) ) ) , search ( nwr ( keyval ( 'shop' , 'furniture' ) ) ) , maxdist ( WALKING_DIST ) , topx ( 1 ) ) , qtype ( latlong ) )
addr city Industrial Buildings in Birmingham	query ( area ( keyval ( 'name' , 'Birmingham' ) ) , nwr ( keyval ( 'building' , 'industrial' ) ) , qtype ( findkey ( 'addr:city' ) ) )
cash machines in Birmingham	query ( area ( keyval ( 'name' , 'Birmingham' ) ) , nwr ( keyval ( 'amenity' , 'atm' ) ) , qtype ( latlong ) )
Is there Cemeterys near Springthorpe Road in Birmingham	query ( around ( center ( area ( keyval ( 'name' , 'Birmingham' ) ) , nwr ( keyval ( 'name' , 'Springthorpe_Road' ) ) ) , search ( nwr ( keyval ( 'landuse' , 'cemetery' ) ) ) , maxdist ( DIST_INTOWN ) ) , qtype ( least ( topx ( 1 ) ) ) )
Is there Farm Buildings in Birmingham	query ( area ( keyval ( 'name' , 'Birmingham' ) ) , nwr ( keyval ( 'building' , 'farm' ) ) , qtype ( least ( topx ( 1 ) ) ) )
How many Hotels in Birmingham	query ( area ( keyval ( 'name' , 'Birmingham' ) ) , nwr ( keyval ( 'tourism' , 'hotel' ) ) , qtype ( count ) )
Is there Hamlet in Birmingham	query ( area ( keyval ( 'name' , 'Birmingham' ) ) , nwr ( keyval ( 'place' , 'hamlet' ) ) , qtype ( least ( topx ( 1 ) ) ) )
How many Pharmacys near Birmingham in walking distance	query ( around ( center ( nwr ( keyval ( 'name' , 'Birmingham' ) ) ) , search ( nwr ( keyval ( 'amenity' , 'pharmacy' ) ) ) , maxdist ( WALKING_DIST ) ) , qtype ( count ) )
How many Phone Booths in Birmingham	query ( area ( keyval ( 'name' , 'Birmingham' ) ) , nwr ( keyval ( 'amenity' , 'telephone' ) ) , qtype ( count ) )
Where Prisons in Birmingham	query ( area ( keyval ( 'name' , 'Birmingham' ) ) , nwr ( keyval ( 'amenity' , 'prison' ) ) , qtype ( latlong ) )
How many Lock Gates in Birmingham	query ( area ( keyval ( 'name' , 'Birmingham' ) ) , nwr ( keyval ( 'waterway' , 'lock_gate' ) ) , qtype ( count ) )
Is there close by Guest House from Qasim in Birmingham	query ( around ( center ( area ( keyval ( 'name' , 'Birmingham' ) ) , nwr ( keyval ( 'name' , 'Qasim' ) ) ) , search ( nwr ( keyval ( 'tourism' , 'guest_house' ) ) ) , maxdist ( DIST_INTOWN ) , topx ( 1 ) ) , qtype ( least ( topx ( 1 ) ) ) )
Is there Health Centres near Lodge Road in Birmingham in walking distance	query ( around ( center ( area ( keyval ( 'name' , 'Birmingham' ) ) , nwr ( keyval ( 'name' , 'Lodge_Road' ) ) ) , search ( nwr ( keyval ( 'amenity' , 'health_centre' ) ) ) , maxdist ( WALKING_DIST ) ) , qtype ( least ( topx ( 1 ) ) ) )
Where Bicycle Rentals in Birmingham	query ( area ( keyval ( 'name' , 'Birmingham' ) ) , nwr ( keyval ( 'amenity' , 'bicycle_rental' ) ) , qtype ( latlong ) )
Where Residential Area in Birmingham	query ( area ( keyval ( 'name' , 'Birmingham' ) ) , nwr ( keyval ( 'landuse' , 'residential' ) ) , qtype ( latlong ) )
Where Art Shops near Stratford Road in Birmingham in walking distance	query ( around ( center ( area ( keyval ( 'name' , 'Birmingham' ) ) , nwr ( keyval ( 'name' , 'Stratford_Road' ) ) ) , search ( nwr ( keyval ( 'shop' , 'art' ) ) ) , maxdist ( WALKING_DIST ) ) , qtype ( latlong ) )
How many Moors near Birmingham in walking distance	query ( around ( center ( nwr ( keyval ( 'name' , 'Birmingham' ) ) ) , search ( nwr ( keyval ( 'place' , 'moor' ) ) ) , maxdist ( WALKING_DIST ) ) , qtype ( count ) )
Is there Museums near University CHP in Birmingham	query ( around ( center ( area ( keyval ( 'name' , 'Birmingham' ) ) , nwr ( keyval ( 'name' , 'University_CHP' ) ) ) , search ( nwr ( keyval ( 'tourism' , 'museum' ) ) ) , maxdist ( DIST_INTOWN ) ) , qtype ( least ( topx ( 1 ) ) ) )
Opticians near Hollie Lucas Road in Birmingham	query ( around ( center ( area ( keyval ( 'name' , 'Birmingham' ) ) , nwr ( keyval ( 'name' , 'Hollie_Lucas_Road' ) ) ) , search ( nwr ( keyval ( 'shop' , 'optician' ) ) ) , maxdist ( DIST_INTOWN ) ) , qtype ( latlong ) )
Is there close by Veterinary Surgery from Ladywood Circus in Birmingham	query ( around ( center ( area ( keyval ( 'name' , 'Birmingham' ) ) , nwr ( keyval ( 'name' , 'Ladywood_Circus' ) ) ) , search ( nwr ( keyval ( 'amenity' , 'veterinary' ) ) ) , maxdist ( DIST_INTOWN ) , topx ( 1 ) ) , qtype ( least ( topx ( 1 ) ) ) )
Is there Sports Pitches in Birmingham	query ( area ( keyval ( 'name' , 'Birmingham' ) ) , nwr ( keyval ( 'leisure' , 'pitch' ) ) , qtype ( least ( topx ( 1 ) ) ) )
addr city Gift Shop in Birmingham	query ( area ( keyval ( 'name' , 'Birmingham' ) ) , nwr ( keyval ( 'shop' , 'gift' ) ) , qtype ( findkey ( 'addr:city' ) ) )
Sports Center in Birmingham	query ( area ( keyval ( 'name' , 'Birmingham' ) ) , nwr ( keyval ( 'leisure' , 'sports_centre' ) ) , qtype ( latlong ) )
Where Bureau de Changes in Birmingham	query ( area ( keyval ( 'name' , 'Birmingham' ) ) , nwr ( keyval ( 'amenity' , 'bureau_de_change' ) ) , qtype ( latlong ) )
Where Hostel in Birmingham	query ( area ( keyval ( 'name' , 'Birmingham' ) ) , nwr ( keyval ( 'tourism' , 'hostel' ) ) , qtype ( latlong ) )
amenity Drinking Water in Birmingham	query ( area ( keyval ( 'name' , 'Birmingham' ) ) , nwr ( keyval ( 'amenity' , 'drinking_water' ) ) , qtype ( findkey ( 'amenity' ) ) )
addr interpolation Terrace in Birmingham	query ( area ( keyval ( 'name' , 'Birmingham' ) ) , nwr ( keyval ( 'building' , 'terrace' ) ) , qtype ( findkey ( 'addr:interpolation' ) ) )
How many Gas Stations in Birmingham	query ( area ( keyval ( 'name' , 'Birmingham' ) ) , nwr ( keyval ( 'amenity' , 'fuel' ) ) , qtype ( count ) )
Kindergarten in Birmingham	query ( area ( keyval ( 'name' , 'Birmingham' ) ) , nwr ( keyval ( 'amenity' , 'kindergarten' ) ) , qtype ( latlong ) )
Is there Minor Road in Birmingham	query ( area ( keyval ( 'name' , 'Birmingham' ) ) , nwr ( keyval ( 'highway' , 'minor' ) ) , qtype ( least ( topx ( 1 ) ) ) )
Is there Ruin in Birmingham	query ( area ( keyval ( 'name' , 'Birmingham' ) ) , nwr ( keyval ( 'historic' , 'ruins' ) ) , qtype ( least ( topx ( 1 ) ) ) )
How many Toilets near Longbridge Methodist Church in Birmingham in walking distance	query ( around ( center ( area ( keyval ( 'name' , 'Birmingham' ) ) , nwr ( keyval ( 'name' , 'Longbridge_Methodist_Church' ) ) ) , search ( nwr ( keyval ( 'amenity' , 'toilets' ) ) ) , maxdist ( WALKING_DIST ) ) , qtype ( count ) )
How many closest Office Building from Stratford Road in Birmingham	query ( around ( center ( area ( keyval ( 'name' , 'Birmingham' ) ) , nwr ( keyval ( 'name' , 'Stratford_Road' ) ) ) , search ( nwr ( keyval ( 'building' , 'office' ) ) ) , maxdist ( DIST_INTOWN ) , topx ( 1 ) ) , qtype ( count ) )
Is there Carpet Shops in Birmingham	query ( area ( keyval ( 'name' , 'Birmingham' ) ) , nwr ( keyval ( 'shop' , 'carpet' ) ) , qtype ( least ( topx ( 1 ) ) ) )
name closest Department Store from Shakespear Crescent in Birmingham	query ( around ( center ( area ( keyval ( 'name' , 'Birmingham' ) ) , nwr ( keyval ( 'name' , 'Shakespear_Crescent' ) ) ) , search ( nwr ( keyval ( 'shop' , 'department_store' ) ) ) , maxdist ( DIST_INTOWN ) , topx ( 1 ) ) , qtype ( findkey ( 'name' ) ) )
name Military Areas in Birmingham	query ( area ( keyval ( 'name' , 'Birmingham' ) ) , nwr ( keyval ( 'landuse' , 'military' ) ) , qtype ( findkey ( 'name' ) ) )
Where Health Center in Birmingham	query ( area ( keyval ( 'name' , 'Birmingham' ) ) , nwr ( keyval ( 'amenity' , 'health_centre' ) ) , qtype ( latlong ) )
How many Food Shops in Birmingham	query ( area ( keyval ( 'name' , 'Birmingham' ) ) , nwr ( keyval ( 'shop' , 'food' ) ) , qtype ( count ) )
How many Hardware Store in Birmingham	query ( area ( keyval ( 'name' , 'Birmingham' ) ) , nwr ( keyval ( 'shop' , 'hardware' ) ) , qtype ( count ) )
Is there Rapids near Oakridge Road in Birmingham	query ( around ( center ( area ( keyval ( 'name' , 'Birmingham' ) ) , nwr ( keyval ( 'name' , 'Oakridge_Road' ) ) ) , search ( nwr ( keyval ( 'waterway' , 'rapids' ) ) ) , maxdist ( DIST_INTOWN ) ) , qtype ( least ( topx ( 1 ) ) ) )
Is there Boat Ramps in Birmingham	query ( area ( keyval ( 'name' , 'Birmingham' ) ) , nwr ( keyval ( 'leisure' , 'slipway' ) ) , qtype ( least ( topx ( 1 ) ) ) )
Is there close by Clinic from Designer Hair & Beauty in Birmingham	query ( around ( center ( area ( keyval ( 'name' , 'Birmingham' ) ) , nwr ( keyval ( 'name' , 'Designer_Hair_&_Beauty' ) ) ) , search ( nwr ( keyval ( 'amenity' , 'clinic' ) ) ) , maxdist ( DIST_INTOWN ) , topx ( 1 ) ) , qtype ( least ( topx ( 1 ) ) ) )
Is there Screes near Burley Way in Birmingham	query ( around ( center ( area ( keyval ( 'name' , 'Birmingham' ) ) , nwr ( keyval ( 'name' , 'Burley_Way' ) ) ) , search ( nwr ( keyval ( 'natural' , 'scree' ) ) ) , maxdist ( DIST_INTOWN ) ) , qtype ( least ( topx ( 1 ) ) ) )
Where Citys near Pickwick Grove in Birmingham	query ( around ( center ( area ( keyval ( 'name' , 'Birmingham' ) ) , nwr ( keyval ( 'name' , 'Pickwick_Grove' ) ) ) , search ( nwr ( keyval ( 'place' , 'city' ) ) ) , maxdist ( DIST_INTOWN ) ) , qtype ( latlong ) )
name closest Toy Shop from Argos in Birmingham	query ( around ( center ( area ( keyval ( 'name' , 'Birmingham' ) ) , nwr ( keyval ( 'name' , 'Argos' ) ) ) , search ( nwr ( keyval ( 'shop' , 'toys' ) ) ) , maxdist ( DIST_INTOWN ) , topx ( 1 ) ) , qtype ( findkey ( 'name' ) ) )
Where Ruins in Birmingham	query ( area ( keyval ( 'name' , 'Birmingham' ) ) , nwr ( keyval ( 'historic' , 'ruins' ) ) , qtype ( latlong ) )
How many Channels near Birmingham	query ( around ( center ( nwr ( keyval ( 'name' , 'Birmingham' ) ) ) , search ( nwr ( keyval ( 'natural' , 'channel' ) ) ) , maxdist ( DIST_INTOWN ) ) , qtype ( count ) )
How many closest Trunk Road from lodge to no 35 in Birmingham in walking distance	query ( around ( center ( area ( keyval ( 'name' , 'Birmingham' ) ) , nwr ( keyval ( 'name' , 'lodge_to_no_35' ) ) ) , search ( nwr ( keyval ( 'highway' , 'trunk_link' ) ) ) , maxdist ( WALKING_DIST ) , topx ( 1 ) ) , qtype ( count ) )
Is there Shopping Centers in Birmingham	query ( area ( keyval ( 'name' , 'Birmingham' ) ) , nwr ( keyval ( 'shop' , 'shopping_centre' ) ) , qtype ( least ( topx ( 1 ) ) ) )
How many closest Miniature Golf from Shirley Road in Birmingham in walking distance	query ( around ( center ( area ( keyval ( 'name' , 'Birmingham' ) ) , nwr ( keyval ( 'name' , 'Shirley_Road' ) ) ) , search ( nwr ( keyval ( 'leisure' , 'miniature_golf' ) ) ) , maxdist ( WALKING_DIST ) , topx ( 1 ) ) , qtype ( count ) )
Community Center in Birmingham	query ( area ( keyval ( 'name' , 'Birmingham' ) ) , nwr ( keyval ( 'amenity' , 'community_centre' ) ) , qtype ( latlong ) )
Where closest Wetland from Ladywood Middleway in Birmingham	query ( around ( center ( area ( keyval ( 'name' , 'Birmingham' ) ) , nwr ( keyval ( 'name' , 'Ladywood_Middleway' ) ) ) , search ( nwr ( keyval ( 'natural' , 'wetland' ) ) ) , maxdist ( DIST_INTOWN ) , topx ( 1 ) ) , qtype ( latlong ) )
Is there Forests in Birmingham	query ( area ( keyval ( 'name' , 'Birmingham' ) ) , nwr ( keyval ( 'landuse' , 'forest' ) ) , qtype ( least ( topx ( 1 ) ) ) )
Where closest Bar from Winson Green Road in Birmingham	query ( around ( center ( area ( keyval ( 'name' , 'Birmingham' ) ) , nwr ( keyval ( 'name' , 'Winson_Green_Road' ) ) ) , search ( nwr ( keyval ( 'amenity' , 'bar' ) ) ) , maxdist ( DIST_INTOWN ) , topx ( 1 ) ) , qtype ( latlong ) )
How many closest Zoo from Tablites in Birmingham	query ( around ( center ( area ( keyval ( 'name' , 'Birmingham' ) ) , nwr ( keyval ( 'name' , 'Tablites' ) ) ) , search ( nwr ( keyval ( 'tourism' , 'zoo' ) ) ) , maxdist ( DIST_INTOWN ) , topx ( 1 ) ) , qtype ( count ) )
Is there Night Clubs in Birmingham	query ( area ( keyval ( 'name' , 'Birmingham' ) ) , nwr ( keyval ( 'amenity' , 'nightclub' ) ) , qtype ( least ( topx ( 1 ) ) ) )
Is there close by Running Track from Firstpress Plastic Moulders Ltd in Birmingham in walking distance	query ( around ( center ( area ( keyval ( 'name' , 'Birmingham' ) ) , nwr ( keyval ( 'name' , 'Firstpress_Plastic_Moulders_Ltd' ) ) ) , search ( nwr ( keyval ( 'leisure' , 'track' ) ) ) , maxdist ( WALKING_DIST ) , topx ( 1 ) ) , qtype ( least ( topx ( 1 ) ) ) )
How many Trees near St Bernard's Catholic Primary School in Birmingham	query ( around ( center ( area ( keyval ( 'name' , 'Birmingham' ) ) , nwr ( keyval ( 'name' , 'St_Bernard's_Catholic_Primary_School' ) ) ) , search ( nwr ( keyval ( 'natural' , 'tree' ) ) ) , maxdist ( DIST_INTOWN ) ) , qtype ( count ) )
Is there Bars near Elmwood United Reformed Church in Birmingham	query ( around ( center ( area ( keyval ( 'name' , 'Birmingham' ) ) , nwr ( keyval ( 'name' , 'Elmwood_United__Reformed_Church' ) ) ) , search ( nwr ( keyval ( 'amenity' , 'pub' ) ) ) , maxdist ( DIST_INTOWN ) ) , qtype ( least ( topx ( 1 ) ) ) )
Is there Water Points near Field Marshall Sir Claude Auchinleck in Birmingham	query ( around ( center ( area ( keyval ( 'name' , 'Birmingham' ) ) , nwr ( keyval ( 'name' , 'Field_Marshall_Sir_Claude_Auchinleck' ) ) ) , search ( nwr ( keyval ( 'waterway' , 'water_point' ) ) ) , maxdist ( DIST_INTOWN ) ) , qtype ( least ( topx ( 1 ) ) ) )
Car Rental in Birmingham	query ( area ( keyval ( 'name' , 'Birmingham' ) ) , nwr ( keyval ( 'amenity' , 'car_rental' ) ) , qtype ( latlong ) )
Is there Petrol Station in Birmingham	query ( area ( keyval ( 'name' , 'Birmingham' ) ) , nwr ( keyval ( 'amenity' , 'fuel' ) ) , qtype ( least ( topx ( 1 ) ) ) )
How many Tertiary Road in Birmingham	query ( area ( keyval ( 'name' , 'Birmingham' ) ) , nwr ( keyval ( 'highway' , 'tertiary' ) ) , qtype ( count ) )
closest Attraction from Lucas Circus in Birmingham	query ( around ( center ( area ( keyval ( 'name' , 'Birmingham' ) ) , nwr ( keyval ( 'name' , 'Lucas_Circus' ) ) ) , search ( nwr ( keyval ( 'tourism' , 'attraction' ) ) ) , maxdist ( DIST_INTOWN ) , topx ( 1 ) ) , qtype ( latlong ) )
How many Dry Cleaning in Birmingham	query ( area ( keyval ( 'name' , 'Birmingham' ) ) , nwr ( keyval ( 'shop' , 'dry_cleaning' ) ) , qtype ( count ) )
addr city Dentists in Birmingham	query ( area ( keyval ( 'name' , 'Birmingham' ) ) , nwr ( keyval ( 'amenity' , 'dentist' ) ) , qtype ( findkey ( 'addr:city' ) ) )
Is there close by Car Wash from Parkar in Birmingham in walking distance	query ( around ( center ( area ( keyval ( 'name' , 'Birmingham' ) ) , nwr ( keyval ( 'name' , 'Parkar' ) ) ) , search ( nwr ( keyval ( 'amenity' , 'car_wash' ) ) ) , maxdist ( WALKING_DIST ) , topx ( 1 ) ) , qtype ( least ( topx ( 1 ) ) ) )
How many closest Cliff from City Arcade in Birmingham in walking distance	query ( around ( center ( area ( keyval ( 'name' , 'Birmingham' ) ) , nwr ( keyval ( 'name' , 'City_Arcade' ) ) ) , search ( nwr ( keyval ( 'natural' , 'cliff' ) ) ) , maxdist ( WALKING_DIST ) , topx ( 1 ) ) , qtype ( count ) )
How many closest Convenience Store from Kingsleigh Croft in Birmingham in walking distance	query ( around ( center ( area ( keyval ( 'name' , 'Birmingham' ) ) , nwr ( keyval ( 'name' , 'Kingsleigh_Croft' ) ) ) , search ( nwr ( keyval ( 'shop' , 'convenience' ) ) ) , maxdist ( WALKING_DIST ) , topx ( 1 ) ) , qtype ( count ) )
amenity Reception Areas in Birmingham	query ( area ( keyval ( 'name' , 'Birmingham' ) ) , nwr ( keyval ( 'amenity' , 'reception_area' ) ) , qtype ( findkey ( 'amenity' ) ) )
Is there Bank in Birmingham	query ( area ( keyval ( 'name' , 'Birmingham' ) ) , nwr ( keyval ( 'amenity' , 'bank' ) ) , qtype ( least ( topx ( 1 ) ) ) )
Is there Quarries in Birmingham	query ( area ( keyval ( 'name' , 'Birmingham' ) ) , nwr ( keyval ( 'landuse' , 'quarry' ) ) , qtype ( least ( topx ( 1 ) ) ) )
Where Colleges in Birmingham	query ( area ( keyval ( 'name' , 'Birmingham' ) ) , nwr ( keyval ( 'amenity' , 'college' ) ) , qtype ( latlong ) )
Is there Food Shop in Birmingham	query ( area ( keyval ( 'name' , 'Birmingham' ) ) , nwr ( keyval ( 'shop' , 'food' ) ) , qtype ( least ( topx ( 1 ) ) ) )
closest Unclassified Road from Stratstone Harley-Davidson in Birmingham in walking distance	query ( around ( center ( area ( keyval ( 'name' , 'Birmingham' ) ) , nwr ( keyval ( 'name' , 'Stratstone_Harley-Davidson' ) ) ) , search ( nwr ( keyval ( 'highway' , 'unclassified' ) ) ) , maxdist ( WALKING_DIST ) , topx ( 1 ) ) , qtype ( latlong ) )
Is there Beverages Shops in Birmingham	query ( area ( keyval ( 'name' , 'Birmingham' ) ) , nwr ( keyval ( 'shop' , 'beverages' ) ) , qtype ( least ( topx ( 1 ) ) ) )
How many Pharmacy in Birmingham	query ( area ( keyval ( 'name' , 'Birmingham' ) ) , nwr ( keyval ( 'amenity' , 'pharmacy' ) ) , qtype ( count ) )
addr housenumber Places of Worship near Zebra Worldwide Machinery in Birmingham	query ( around ( center ( area ( keyval ( 'name' , 'Birmingham' ) ) , nwr ( keyval ( 'name' , 'Zebra_Worldwide_Machinery' ) ) ) , search ( nwr ( keyval ( 'amenity' , 'place_of_worship' ) ) ) , maxdist ( DIST_INTOWN ) ) , qtype ( findkey ( 'addr:housenumber' ) ) )
Where Water Points near KB in Birmingham	query ( around ( center ( area ( keyval ( 'name' , 'Birmingham' ) ) , nwr ( keyval ( 'name' , 'KB' ) ) ) , search ( nwr ( keyval ( 'waterway' , 'water_point' ) ) ) , maxdist ( DIST_INTOWN ) ) , qtype ( latlong ) )
Is there Volcanos in Birmingham	query ( area ( keyval ( 'name' , 'Birmingham' ) ) , nwr ( keyval ( 'natural' , 'volcano' ) ) , qtype ( least ( topx ( 1 ) ) ) )
Where Nursing Homes in Birmingham	query ( area ( keyval ( 'name' , 'Birmingham' ) ) , nwr ( keyval ( 'amenity' , 'nursing_home' ) ) , qtype ( latlong ) )
Marinas in Birmingham	query ( area ( keyval ( 'name' , 'Birmingham' ) ) , nwr ( keyval ( 'leisure' , 'marina' ) ) , qtype ( latlong ) )
Is there close by Hunting Stand from Saltley Business Park in Birmingham	query ( around ( center ( area ( keyval ( 'name' , 'Birmingham' ) ) , nwr ( keyval ( 'name' , 'Saltley_Business_Park' ) ) ) , search ( nwr ( keyval ( 'amenity' , 'hunting_stand' ) ) ) , maxdist ( DIST_INTOWN ) , topx ( 1 ) ) , qtype ( least ( topx ( 1 ) ) ) )
